{"$schema": "https://json-schema.org/draft/2020-12/schema","additionalProperties": false,"properties": {"analysisProtocol": {"const": "protocols/ala-lv-analysis.v1.json"},"branches": {"const": ["normal", "disabled", "constant", "random", "shuffled", "ledger-consistent", "ledger-shuffled"]},"channel": {"additionalProperties": false,"properties": {"capacityClaimBoundary": {"type": "string"},"carrier": {"const": "fixed-token"},"deliveredTokenInventory": {"additionalProperties": false,"properties": {"constructor": {"const": "fixedTokenInventory(32)"},"source": {"type": "string"},"tokens": {"items": {"type": "string"},"maxItems": 32,"minItems": 32}},"required": ["constructor", "source", "tokens"],"type": "object"},"inventorySize": {"const": 32},"marksPerMessage": {"const": 1},"maximumCapacityBits": {"const": 5}},"required": ["carrier", "inventorySize", "marksPerMessage", "maximumCapacityBits", "capacityClaimBoundary", "deliveredTokenInventory"],"type": "object"},"chronology": {"items": {"type": "string"},"minItems": 7,"type": "array"},"classification": {"const": "prospective-ala-ledger-value-study"},"cohorts": {"additionalProperties": false,"properties": {"A": {"additionalProperties": false,"properties": {"batches": {"const": 4},"batchSize": {"const": 5},"primaries": {"const": 20},"replacementRule": {"type": "string"},"reserves": {"const": 2}},"required": ["primaries", "reserves", "batches", "batchSize", "replacementRule"],"type": "object"},"B": {"additionalProperties": false,"properties": {"batches": {"const": 4},"batchSize": {"const": 5},"freshSeeds": {"const": true},"primaries": {"const": 20},"replacementRule": {"type": "string"},"reserves": {"const": 2}},"required": ["primaries", "reserves", "batches", "batchSize", "freshSeeds", "replacementRule"],"type": "object"},"fallback": {"type": "string"},"unit": {"type": "string"}},"required": ["A", "B", "fallback", "unit"],"type": "object"},"costs": {"additionalProperties": false,"properties": {"amendment": {"const": "protocols/ala-lv-scope-and-resource-amendment.v1.json"},"campaignCpuHoursMax": {"const": 12.0},"note": {"type": "string"}},"required": ["amendment", "campaignCpuHoursMax", "note"],"type": "object"},"evaluation": {"additionalProperties": false,"properties": {"branchOrder": {"type": "string"},"branches": {"const": ["normal", "disabled", "constant", "random", "shuffled", "ledger-consistent", "ledger-shuffled"]},"freezeRule": {"type": "string"},"interventionRule": {"type": "string"},"receiverDecisionsDerivation": {"type": "string"},"receiverDecisionsPerDyad": {"const": 5160},"restoreRule": {"type": "string"},"sharedActionRandomness": {"type": "string"},"testReceiverDecisionsPerDyad": {"const": 1680}},"required": ["freezeRule", "restoreRule", "sharedActionRandomness", "branchOrder", "branches", "receiverDecisionsPerDyad", "testReceiverDecisionsPerDyad", "receiverDecisionsDerivation", "interventionRule"],"type": "object"},"execution": {"additionalProperties": false,"properties": {"anchorClass": {"const": "simulated"},"checkpointEventInterval": {"const": 64},"deadlineRule": {"type": "string"},"deploymentMode": {"const": "prototype"},"maximumParallelDyads": {"const": 1},"releaseSchedule": {"type": "string"},"topology": {"const": "prototype-disposable-worker"}},"required": ["deploymentMode", "topology", "anchorClass", "releaseSchedule", "deadlineRule", "checkpointEventInterval", "maximumParallelDyads"],"type": "object"},"executionManifest": {"const": "protocols/ala-lv-execution-manifest.v1.json"},"freezeDate": {"const": "2026-10-09"},"invalidity": {"additionalProperties": false,"properties": {"replacement": {"type": "string"},"rule": {"type": "string"},"validObservations": {"type": "string"}},"required": ["rule", "validObservations", "replacement"],"type": "object"},"learner": {"additionalProperties": false,"properties": {"agents": {"const": 2},"architecture": {"const": "gru-actor-critic-v1"},"evaluationLearning": {"const": false},"forbidden": {"items": {"type": "string"},"minItems": 1,"type": "array"},"hiddenSize": {"const": 16},"inputSize": {"const": 50},"learningSignal": {"const": "extrinsic-task"},"optimizer": {"additionalProperties": false,"properties": {"beta1": {"const": 0.9},"beta2": {"const": 0.999},"epsilon": {"const": 1e-8},"learningRate": {"const": 0.003},"name": {"const": "adam-v1"}},"required": ["name", "learningRate", "beta1", "beta2", "epsilon"],"type": "object"},"parameterCountPerAgent": {"const": 4049},"receiverOutputSize": {"const": 16},"reinforcement": {"additionalProperties": false,"properties": {"maxGradientNorm": {"const": 1},"ppoClip": {"const": 0.2},"ppoEpochs": {"const": 4},"valueLossCoefficient": {"const": 0.5}},"required": ["ppoClip", "ppoEpochs", "valueLossCoefficient", "maxGradientNorm"],"type": "object"},"roleReversalPeriod": {"const": 1},"senderOutputSize": {"const": 32},"temperature": {"const": 1},"track": {"const": "scratch-rl"},"trainingIsolation": {"const": "independent"},"valueOutputSize": {"const": 1}},"required": ["track", "architecture", "agents", "trainingIsolation", "inputSize", "hiddenSize", "senderOutputSize", "receiverOutputSize", "valueOutputSize", "parameterCountPerAgent", "learningSignal", "optimizer", "reinforcement", "temperature", "roleReversalPeriod", "evaluationLearning", "forbidden"],"type": "object"},"observationSchemas": {"additionalProperties": false,"properties": {"agentAllowed": {"items": {"type": "string"},"type": "array"},"agentForbidden": {"items": {"type": "string"},"type": "array"},"claimBoundary": {"type": "string"},"predictorForbidden": {"items": {"type": "string"},"type": "array"},"receiver": {"additionalProperties": false,"properties": {"allowed": {"items": {"type": "string"},"type": "array"},"forbidden": {"items": {"type": "string"},"type": "array"}},"required": ["allowed", "forbidden"],"type": "object"},"roleReading": {"type": "string"},"sender": {"additionalProperties": false,"properties": {"allowed": {"items": {"type": "string"},"type": "array"},"forbidden": {"items": {"type": "string"},"type": "array"}},"required": ["allowed", "forbidden"],"type": "object"},"senderAllowed": {"items": {"type": "string"},"type": "array"}},"required": ["agentAllowed", "agentForbidden", "senderAllowed", "roleReading", "sender", "receiver", "predictorForbidden", "claimBoundary"],"type": "object"},"preActionCommitment": {"additionalProperties": false,"properties": {"accessBoundary": {"type": "string"},"payload": {"items": {"type": "string"},"minItems": 7,"type": "array"},"persistence": {"type": "string"}},"required": ["payload", "persistence", "accessBoundary"],"type": "object"},"question": {"type": "string"},"relationshipToLV01": {"type": "string"},"researchFinding": {"const": false},"retention": {"additionalProperties": false,"properties": {"blobRule": {"type": "string"},"eventContent": {"type": "string"},"replayQualification": {"type": "string"},"snapshotContent": {"type": "string"},"snapshots": {"items": {"type": "string"},"minItems": 4,"type": "array"}},"required": ["snapshots", "snapshotContent", "eventContent", "blobRule", "replayQualification"],"type": "object"},"runConfig": {"additionalProperties": false,"properties": {"analysisVersion": {"const": "ala-lv-analysis/v1"},"branches": {"const": ["normal", "disabled", "constant", "random", "shuffled", "ledger-consistent", "ledger-shuffled"]},"cohorts": {"const": ["A", "B"]},"deploymentMode": {"const": "prototype"},"designVersion": {"const": "ala-lv-study/v1"},"estimationOnly": {"const": true},"finalPairedCases": {"const": 240},"receiverDecisionsPerDyad": {"const": 5160},"seedPolicyRef": {"type": "string"},"seedRoot": {"const": "ala-ledger-value-v1"},"snapshotEventCadence": {"const": 64},"studyId": {"const": "ALA-LV"},"trainingCases": {"const": 3000},"validationFitCases": {"const": 240},"validationSelectionCases": {"const": 240}},"required": ["studyId", "designVersion", "analysisVersion", "seedPolicyRef", "seedRoot", "trainingCases", "validationFitCases", "validationSelectionCases", "finalPairedCases", "branches", "receiverDecisionsPerDyad", "snapshotEventCadence", "deploymentMode", "cohorts", "estimationOnly"],"type": "object"},"schemaVersion": {"const": 1},"scientificDisposition": {"const": "not-tested"},"scopeAmendment": {"const": "protocols/ala-lv-scope-and-resource-amendment.v1.json"},"scopeBoundary": {"items": {"type": "string"},"minItems": 5,"type": "array"},"seeds": {"additionalProperties": false,"properties": {"derivation": {"additionalProperties": false,"properties": {"algorithm": {"type": "string"},"parts": {"items": {"type": "string"},"type": "array"}},"required": ["algorithm", "parts"],"type": "object"},"partValues": {"additionalProperties": false,"properties": {"cohorts": {"const": ["development", "calibration", "A", "B"]},"partitions": {"const": ["training", "validation-fit", "validation-selection", "within-support-test"]},"policyVersion": {"const": "v1"},"purposes": {"items": {"type": "string"},"minItems": 8,"type": "array"},"roles": {"items": {"type": "string"},"minItems": 3,"type": "array"},"root": {"const": "ala-ledger-value-v1"},"slotIndex": {"type": "string"},"slotKinds": {"const": ["primary", "reserve"]},"studyId": {"const": "ALA-LV"}},"required": ["root", "studyId", "cohorts", "policyVersion", "slotKinds", "slotIndex", "purposes", "roles", "partitions"],"type": "object"},"prohibited": {"items": {"type": "string"},"minItems": 4,"type": "array"},"retainedIdentityAudit": {"type": "string"},"roleStreamSeparation": {"type": "string"},"rule": {"type": "string"},"slotIndexing": {"type": "string"}},"required": ["derivation", "partValues", "rule", "roleStreamSeparation", "slotIndexing", "prohibited", "retainedIdentityAudit"],"type": "object"},"status": {"const": "frozen"},"studyId": {"const": "ALA-LV"},"studyVersion": {"const": "ala-lv-study/v1"},"task": {"additionalProperties": false,"properties": {"attributeCount": {"const": 2},"candidatesPerEpisode": {"const": 4},"chanceSuccess": {"const": 0.25},"claimBoundary": {"type": "string"},"duplicateRule": {"type": "string"},"eligibleTypeCodes": {"const": [1, 2, 3, 4, 6, 7, 8, 9, 11, 12, 13, 14]},"generator": {"const": "referential-game-v1"},"partitions": {"additionalProperties": false,"properties": {"training": {"additionalProperties": false,"properties": {"cases": {"const": 3000},"perEligibleTargetPerRole": {"const": 125},"perReceiverRole": {"const": 1500},"policyUpdates": {"const": true}},"required": ["cases", "perReceiverRole", "perEligibleTargetPerRole", "policyUpdates"],"type": "object"},"validationFit": {"additionalProperties": false,"properties": {"cases": {"const": 240},"perEligibleTargetPerRole": {"const": 10},"perReceiverRole": {"const": 120},"policyUpdates": {"const": false}},"required": ["cases", "perReceiverRole", "perEligibleTargetPerRole", "policyUpdates"],"type": "object"},"validationSelection": {"additionalProperties": false,"properties": {"cases": {"const": 240},"perEligibleTargetPerRole": {"const": 10},"perReceiverRole": {"const": 120},"policyUpdates": {"const": false}},"required": ["cases", "perReceiverRole", "perEligibleTargetPerRole", "policyUpdates"],"type": "object"},"withinSupportTest": {"additionalProperties": false,"properties": {"cases": {"const": 240},"perEligibleTargetPerRole": {"const": 10},"perReceiverRole": {"const": 120},"policyUpdates": {"const": false}},"required": ["cases", "perReceiverRole", "perEligibleTargetPerRole", "policyUpdates"],"type": "object"}},"required": ["training", "validationFit", "validationSelection", "withinSupportTest"],"type": "object"},"prohibitedSplits": {"const": ["held-out", "evaluation"]},"typeCodeRule": {"const": "4 * firstAttribute + secondAttribute"},"untouchedTypeCodes": {"const": [0, 5, 10, 15]},"valuesPerAttribute": {"const": 4}},"required": ["generator", "attributeCount", "valuesPerAttribute", "typeCodeRule", "candidatesPerEpisode", "chanceSuccess", "eligibleTypeCodes", "untouchedTypeCodes", "partitions", "duplicateRule", "prohibitedSplits", "claimBoundary"],"type": "object"}},"required": ["schemaVersion", "studyId", "studyVersion", "classification", "status", "researchFinding", "scientificDisposition", "question", "scopeBoundary", "relationshipToLV01", "task", "learner", "channel", "execution", "evaluation", "observationSchemas", "runConfig", "seeds", "cohorts", "retention", "preActionCommitment", "invalidity", "costs", "chronology", "scopeAmendment", "analysisProtocol", "executionManifest", "freezeDate"],"title": "ALA-LV study contract v1","type": "object"}