{"analysisProtocol": "protocols/ala-lv-analysis.v1.json","branches": ["normal", "disabled", "constant", "random", "shuffled", "ledger-consistent", "ledger-shuffled"],"channel": {"capacityClaimBoundary": "Maximum carrier capacity is not measured information or syntax.","carrier": "fixed-token","deliveredTokenInventory": {"constructor": "fixedTokenInventory(32)","source": "SPEC 9.1 default","tokens": ["S01", "S02", "S03", "S04", "S05", "S06", "S07", "S08", "S09", "S10", "S11", "S12", "S13", "S14", "S15", "S16", "S17", "S18", "S19", "S20", "S21", "S22", "S23", "S24", "S25", "S26", "S27", "S28", "S29", "S30", "S31", "S32"]},"inventorySize": 32,"marksPerMessage": 1,"maximumCapacityBits": 5},"chronology": ["Train once and retain all attempted episodes.", "Freeze policy, optimizer, recurrent state, PRNG state, and authenticated training-ledger cutoff.", "Run validation fitting and selection without updates.", "Prepare normal messages and all final-test branch schedule.", "Commit predictions, messages, identities and schedule before test receiver actions.", "Restore identical pre-case state and execute paired branches.", "Verify evidence before analysis."],"classification": "prospective-ala-ledger-value-study","cohorts": {"A": {"batches": 4,"batchSize": 5,"primaries": 20,"replacementRule": "At most two ordered technically invalid replacements, prospectively reserved and charged; depleted reserves close the cohort incomplete.","reserves": 2},"B": {"batches": 4,"batchSize": 5,"freshSeeds": true,"primaries": 20,"replacementRule": "At most two ordered technically invalid replacements, prospectively reserved and charged; depleted reserves close the cohort incomplete.","reserves": 2},"fallback": "If the 20+20 reservation is unaffordable, 10+10 may be chosen before study collection on resource measurements only, manuscript marked preliminary; no silent partial larger plan.","unit": "independently trained dyad; role/case repetition does not increase N"},"costs": {"amendment": "protocols/ala-lv-scope-and-resource-amendment.v1.json","campaignCpuHoursMax": 12.0,"note": "Caps bind via the amendment; this protocol adds no allowance."},"evaluation": {"branchOrder": "Deterministic seeded permutation per case, counterbalanced across cases.","branches": ["normal", "disabled", "constant", "random", "shuffled", "ledger-consistent", "ledger-shuffled"],"freezeRule": "Freeze final policy bytes, optimizer state, checkpoint hidden state, PRNG state, and ledger cutoff before validation; no evaluation action updates policy, checkpoint, or PRNG state. Restoration is verified by actual weight/optimizer/state/PRNG comparison, not a stored boolean.","interventionRule": "Constant uses inventory element 0; random uses a dedicated uniform stream; shuffled uses a role-local derangement reconstructed from distinct cases with the selected source token verified (naturally coinciding tokens recorded, never forced; no shared target across shuffled cases; never the other receiver's ledger); ledger-consistent selects the native predictor's target-maximizing token with inventory-order ties; ledger-shuffled permutes those selected messages within role using a fixed derangement. The experimenter knows the target for this controlled intervention; receiver and baselines do not.","receiverDecisionsDerivation": "5160 = 3000 training + 240 validation-fit + 240 validation-selection + 1680 test (240 cases x 7 branches); one receiver decision per training/validation episode.","receiverDecisionsPerDyad": 5160,"restoreRule": "Restore the same final training state before every case and branch and each declared case boundary; a branch may advance its own state. Unchanged export hashes do not substitute for a verified live-state reset.","sharedActionRandomness": "Each case uses one privately derived uniform draw, shared across branches, disclosed to the auditor after sealing. Sampling uses a fixed candidate order and inverse CDF; the draw never enters any learner observation or prediction function.","testReceiverDecisionsPerDyad": 1680},"execution": {"anchorClass": "simulated","checkpointEventInterval": 64,"deadlineRule": "Normal termination and resource guards are retained; existing Mode R deadline/safety code is unchanged and not claimed by this profile.","deploymentMode": "prototype","maximumParallelDyads": 1,"releaseSchedule": "none; no artificial one-second release padding in this declared Prototype profile","topology": "prototype-disposable-worker"},"executionManifest": "protocols/ala-lv-execution-manifest.v1.json","freezeDate": "2026-10-09","invalidity": {"replacement": "Replacement consumes only ordered registered reserves; a depleted reserve pool closes the cohort incomplete.","rule": "Frozen technical rules only: wrong source or configuration, partition contamination, missing required evidence, broken chronology or restoration, or execution abort.","validObservations": "Low success, high loss, slow convergence and inconvenient estimates remain valid."},"learner": {"agents": 2,"architecture": "gru-actor-critic-v1","evaluationLearning": false,"forbidden": ["cross-agent updates", "auxiliary reward", "architecture search", "curriculum", "repair", "affect", "negotiation", "policy updates during validation or test"],"hiddenSize": 16,"inputSize": 50,"learningSignal": "extrinsic-task","optimizer": {"beta1": 0.9,"beta2": 0.999,"epsilon": 1e-8,"learningRate": 0.003,"name": "adam-v1"},"parameterCountPerAgent": 4049,"receiverOutputSize": 16,"reinforcement": {"maxGradientNorm": 1,"ppoClip": 0.2,"ppoEpochs": 4,"valueLossCoefficient": 0.5},"roleReversalPeriod": 1,"senderOutputSize": 32,"temperature": 1,"track": "scratch-rl","trainingIsolation": "independent","valueOutputSize": 1},"observationSchemas": {"agentAllowed": ["approved numeric observation tensors", "delivered message tokens", "candidate observations in committed order"],"agentForbidden": ["peer references", "peer weights or hidden state", "true scenario target", "scenario seed", "action draw or action PRNG", "wall clock", "auditor results", "test labels"],"claimBoundary": "Code-path and input-boundary checks must establish this restriction for these cooperative learners. This is logical separation under a trusted process and operator, not resistance to a malicious shared-process agent.","predictorForbidden": ["test outcomes", "action PRNG values", "post-cutoff ledger events", "true test target in ordinary-record fits"],"receiver": {"allowed": ["approved numeric observation tensors", "delivered message tokens", "candidate observations in committed order"],"forbidden": ["peer references", "peer weights or hidden state", "true scenario target", "scenario seed", "action draw or action PRNG values", "wall clock", "auditor results", "test labels", "test outcomes"]},"roleReading": "agentAllowed and agentForbidden bind both roles except the sender row's own target flag: the sender's private referent cue is permitted sender-only input, and 'true scenario target' in agentForbidden binds receiver rows and ordinary-record predictor fits.","sender": {"allowed": ["approved numeric observation tensors", "delivered message tokens", "candidate observations in committed order", "private referent cue (own target flag)"],"forbidden": ["peer references", "peer weights or hidden state", "scenario seed", "action draw or action PRNG values", "wall clock", "auditor results", "test labels", "test outcomes"]},"senderAllowed": ["private referent cue (own target flag)"]},"preActionCommitment": {"accessBoundary": "Test outcomes and action PRNG values must be inaccessible to predictors at commitment time. Reveal/reconstruct draw information only for audit.","payload": ["ordered case and candidate identities", "full probability vectors for native, ordinary-record and replay predictors", "predictor versions and fitted digests", "actual delivered-message schedule", "ledger cutoff", "policy and state digests", "action-draw commitments"],"persistence": "Persist the committed canonical payloads. Hashing the inputs alone is insufficient."},"question": "Does a learner's contemporaneous token-association record predict its receiver actions better than a validation-selected predictor trained on ordinary observations and transcripts, and when does that prediction track causally effective communication?","relationshipToLV01": "ALA-LV reuses LV01 v2's task, learner, channel, workload, predictor, branch, and Prototype execution values as an internal engine family, and explicitly acknowledges them. It is a smaller exploratory estimation study, not execution or completion of LV01's four-member confirmatory family. LV01's sample size, power requirement, margins, stage labels, and historical classifications are unchanged; no LV01 family support/power label may classify ALA cohorts.","researchFinding": false,"retention": {"blobRule": "Share immutable parent/model blobs by digest with explicit references; never clone a full bundle per branch. A digest-only record is a commitment, not an attached snapshot; missing attachments are failures.","eventContent": "every event identity and digest; log every update/event identity and digest","replayQualification": "Verify exact replay across retained checkpoint blocks; if exact replay fails, the retention format is unqualified.","snapshotContent": "full model, optimizer and hidden-state snapshots","snapshots": ["initialization", "every 64 training episodes", "final training cutoff", "all required scientific boundaries"]},"runConfig": {"analysisVersion": "ala-lv-analysis/v1","branches": ["normal", "disabled", "constant", "random", "shuffled", "ledger-consistent", "ledger-shuffled"],"cohorts": ["A", "B"],"deploymentMode": "prototype","designVersion": "ala-lv-study/v1","estimationOnly": true,"finalPairedCases": 240,"receiverDecisionsPerDyad": 5160,"seedPolicyRef": "this-protocol.seeds","seedRoot": "ala-ledger-value-v1","snapshotEventCadence": 64,"studyId": "ALA-LV","trainingCases": 3000,"validationFitCases": 240,"validationSelecti